{
  "schema_version": 2,
  "claim_id": "replace-me",
  "subject_id": "replace-me",
  "candidate_id": "replace-me",
  "statement": "One falsifiable behavior change.",
  "observable_delta": "Artifact or trajectory observation that would support it.",
  "preserved_behaviors": ["Adjacent behavior that must remain intact."],
  "sufficient_evidence": ["Weakest evidence lane that can answer the question."],
  "status": "proposed"
}
